<?xml version="1.0" encoding="UTF-8"?>
<xs:schema xmlns:xs="http://www.w3.org/2001/XMLSchema">
	<xs:element name="rift">
		<xs:complexType>
			<xs:sequence minOccurs="1" maxOccurs="1">
				<xs:element name="area" minOccurs="1" maxOccurs="6">
					<xs:complexType>
						<xs:sequence minOccurs="1" maxOccurs="1">
							<xs:element name="room" minOccurs="1" maxOccurs="9">
								<xs:complexType>
									<xs:sequence minOccurs="1" maxOccurs="1">
										<xs:element name="spawn" minOccurs="1" maxOccurs="3">
											<xs:complexType>
												<xs:attribute name="count" type="xs:positiveInteger" use="required" />
												<xs:attribute name="delay" type="xs:positiveInteger" use="required" />
												<xs:attribute name="mobId" type="xs:positiveInteger" use="required" />
											</xs:complexType>
										</xs:element>
									</xs:sequence>
									<xs:attribute name="id" use="required">
										<xs:simpleType>
											<xs:restriction base="xs:integer">
												<xs:minInclusive value="1" />
												<xs:maxInclusive value="9" />
											</xs:restriction>
										</xs:simpleType>
									</xs:attribute>
								</xs:complexType>
							</xs:element>
						</xs:sequence>
						<xs:attribute name="type" use="required">
							<xs:simpleType>
								<xs:restriction base="xs:integer">
									<xs:minInclusive value="1" />
									<xs:maxInclusive value="6" />
								</xs:restriction>
							</xs:simpleType>
						</xs:attribute>
					</xs:complexType>
				</xs:element>
			</xs:sequence>		</xs:complexType>
	</xs:element>
</xs:schema>